<?xml version="1.0" encoding="UTF-8"?>

<!DOCTYPE cases SYSTEM "misc/cases.dtd" [
        <!ENTITY % content SYSTEM "misc/entity/definitions.inc">
        %content; ]>


<!--- This is scenario to check engine do logoff and reconnect if receive no answer after 2 test requests -->
<cases>
    <case name="Sequence Reset - Reset on login">
        &CLEAN_LOGS;
        &ENGINE_UP;
        <transport className="AcceptorSocketTransport" port="&PORT;">
            <!-- Ask engine to connect to FIXTester Acceptor transport -->
            &SESSION_UP;

            &RECEIVE_LOGON;
            <send>8=FIX.4.2#9=57#35=A#49=&ME;#56=&YOU;#34=2#52=20031027-14:29:11#98=0#108=5#10=126#</send>

            <!-- Send test request with msg seq num too high, expect resend request -->
            <expect>8=FIX.4.2#9=\d*#35=2#49=&YOU;#56=&ME;#34=2#52=&DATETIMEMS;#7=1#16=0#10=\d{3}#</expect>

            <!-- Send sequence reset reset with incorrect number -->
            <send>
                8=FIX.4.2#9=57#35=4#49=&ME;#56=&YOU;#34=3#52=20031027-14:29:11#122=20031027-14:29:11#43=Y#36=9#10=126#
            </send>

            <!-- Exchange with test request to ensure sequences is ok-->
            <send>8=FIX.4.2#9=57#35=1#49=&ME;#56=&YOU;#34=9#52=20031027-14:29:11#112=test01#10=126#</send>
            <expect>8=FIX\.4\.2#9=\d*#35=0#49=&YOU;#56=&ME;#34=3#112=test01#52=&DATETIMEMS;#10=\d{3}#</expect>


            <!-- logout -->
            <send>8=FIX.4.2#9=57#35=5#49=&ME;#56=&YOU;#34=10#52=20031027-14:29:11#10=126#</send>
            <expect>8=FIX\.4\.2#9=\d*#35=5#49=&YOU;#56=&ME;#34=4#52=&DATETIMEMS;#10=\d{3}#</expect>

        </transport>
        &ENGINE_DOWN;
    </case>
</cases>