<?xml version="1.0" encoding="UTF-8"?>
<!DOCTYPE cases SYSTEM "../../../cases.dtd" [
        <!ENTITY % content SYSTEM "../../../Engine/Entities/definitions.inc">
        %content; ]>
<cases>
    <case name="2 TestRequest before disconnect">
        &CLEAN_LOGS;
        <task className="FixEngine.EngineUpWithEchoApp">
            <param name="port">&ENGINE_PORT;</param>
            <param name="name">SERVER</param>
        </task>

        <transport className="InitiatorSocketTransport" host="localhost" port="&ENGINE_PORT;">
            <send>8=FIX.4.2#9=0#35=A#34=1#49=&ME;#52=&DATETIMEMS;#56=&YOU;#98=0#108=5#10=000#</send>
            <expect>8=FIX\.4\.2#9=\d{1,3}#35=A#34=1#49=&YOU;#52=&DATETIMEMS;#56=&ME;#10=\d{3}#</expect>

            <send>8=FIX.4.2#9=0#35=1#34=10#49=&ME;#52=&DATETIMEMS;#56=&YOU;#112=12345678#10=000#</send>
            <!-- TODO: RR should be sent before HBT -->
            <expect>8=FIX\.4\.2#9=\d*#35=0#34=2#49=&YOU;#56=&ME;#52=&DATETIMEMS;#112=12345678#10=\d{3}#</expect>
            <expect>8=FIX\.4\.2#9=\d*#35=2#34=3#49=&YOU;#56=&ME;#52=&DATETIMEMS;#7=2#16=0#10=\d{3}#</expect>
            <send>8=FIX.4.2#9=0#35=4#34=2#49=&ME;#52=&DATETIMEMS;#56=&YOU;#43=Y#123=Y#36=11#10=000#</send>

            <send>8=FIX.4.2#9=0#35=0#34=11#49=&ME;#52=&DATETIMEMS;#56=&YOU;#10=000#</send>
            <expect>8=FIX\.4\.2#9=\d*#35=0#34=4#49=&YOU;#56=&ME;#52=&DATETIMEMS;#10=\d{3}#</expect>

            <send>8=FIX.4.2#9=0#35=5#34=12#49=&ME;#56=&YOU;#52=&DATETIMEMS;#10=000#</send>
        </transport>
        &ENGINE_DOWN;
    </case>
</cases>
