<?xml version="1.0" encoding="UTF-8"?>
<!DOCTYPE cases SYSTEM "../../../../cases.dtd" [
        <!ENTITY % content SYSTEM "../../../../Engine/Entities/definitions.inc">
        %content; ]>
<cases>
    <case name="Skip duplicate RR">
        &CLEAN_LOGS;
        <task className="FixEngine.EngineUpWithEchoApp">
            <param name="port">&ENGINE_PORT;</param>
            <param name="name">SERVER</param>
            <param name="global_advancedResendRequestProcessing">true</param>
            <!--<param name="global_origSendingTimeChecking">false</param>-->
        </task>
        <!-- case POSDUPRR01 -->

        <!--Step 1. Using TCPclient send Logon with HBI=0.-->
        <!--Step 2. Using TCPclient send Heartbeat with 34=4. -->
        <!--Step 5. FIXAJ should send resend request -->
        <!--Step 6. Using TCPclient send Heartbeat with 34=5 and without 369 tag. -->
        <!--Step 7. FIXAJ should send ResendRequest without posdup -->

        <transport className="InitiatorSocketTransport" host="localhost" port="3000">

            <send>8=FIX.4.4#9=123#35=A#34=1#49=TW#52=20031027-14:29:11#56=ISLD#98=0#108=5#10=000#</send>
            <expect>
                 8=FIX\.4\.4#9=\d{1,3}#35=A#34=1#49=ISLD#52=\d{8}-\d{2}:\d{2}:\d{2}(\.\d{3})?#56=TW#10=\d{3}#
            </expect>

            <!-- send orders -->
            <send>
                8=FIX.4.4#9=0#35=D#49=TW#56=ISLD#34=2#50=1#52=00000000-00:00:00#11=cboeopt-06#1=TEST01#21=1#100=DSMD#55=MSFT#54=1#60=20100528-13:02:21#38=100#40=2#44=10#5049=ASH#5056=EHUB#5050=20100528-13:09:41.058#10=000#
            </send>
            <expect>8=FIX\.4\.4#9=\d{1,3}#35=D#34=2#10=\d{3}#</expect>

            <expect>8=FIX\.4\.4#9=\d{1,3}#35=0#34=3#10=\d{3}#</expect>

            <!--<send>-->
                <!--8=FIX.4.4#9=0#35=D#49=TW#56=ISLD#34=4#50=1#52=00000000-00:00:00#43=Y#11=cboeopt-06#1=TEST01#21=1#100=DSMD#55=MSFT#54=1#60=20100528-13:02:21#38=100#40=2#44=10#5049=ASH#5056=EHUB#5050=20100528-13:09:41.058#10=000#-->
            <!--</send>-->
            <!--<send>8=FIX.4.4#9=0#35=0#34=5#49=TW#52=20031027-14:29:11#56=ISLD#10=000#</send>-->

            <send>
                8=FIX.4.4#9=0#35=2#34=3#49=TW#52=00000000-00:00:00#56=ISLD#7=2#16=0#10=000#
            </send>
            <send>
                8=FIX.4.4#9=0#35=2#34=3#49=TW#52=00000000-00:00:00#43=Y#122=20031027-14:29:11#56=ISLD#7=2#16=0#10=000#
            </send>
            <send>8=FIX.4.4#9=0#35=0#34=4#49=TW#52=20031027-14:29:11#56=ISLD#10=000#</send>

            <expect>8=FIX\.4\.4#9=\d{1,3}#35=D#34=2#43=Y#10=\d{3}#</expect>
            <expect>8=FIX\.4\.4#9=\d{1,3}#35=4#34=3#43=Y#36=4#10=\d{3}#</expect>

            <expect>8=FIX\.4\.4#9=\d{1,3}#35=D#34=2#43=Y#10=\d{3}#</expect>
            <expect>8=FIX\.4\.4#9=\d{1,3}#35=4#34=3#43=Y#36=4#10=\d{3}#</expect>

            <expect>8=FIX\.4\.4#9=\d{1,3}#35=0#34=4#10=\d{3}#</expect>

        </transport>
        &ENGINE_DOWN;
    </case>
</cases>
