<?xml version="1.0" encoding="UTF-8"?>

<!DOCTYPE cases SYSTEM "../../../../cases.dtd" [
        <!ENTITY % content SYSTEM "../../../../Engine/Entities/definitions.inc">
        %content; ]>

<cases>

    <!--case SRM04 -->
    <!--testzilla case 10b_001_SR -->
    <!--Step 1. Receive Sequence Reset (Gap Fill) message with NewSeqNo > MsgSeqNum and MsgSeqNum = to   -->
    <!--Step 2. 8=FIX.4.4 9=59 35=4 49=SNDR 56=TRGT 34=2 52=20081225-18:32:15 123=Y 36=10 10=198   	-->
    <!--Step 3. Expected SeqNum should be changed to 10 -->

    <case name="SRM04">
        &CLEAN_LOGS;
        &ENGINE_UP;
        <transport className="InitiatorSocketTransport" host="localhost" port="3000">
            <send>8=FIX.4.4#9=123#35=A#34=1#49=TW#52=20031027-14:29:11#56=ISLD#98=0#108=5#10=000#</send>
            <expect>
                 8=FIX\.4\.4#9=\d{1,3}#35=A#34=1#49=ISLD#52=\d{8}-\d{2}:\d{2}:\d{2}(\.\d{3})?#56=TW#10=\d{3}#
            </expect>

            <send>8=FIX.4.4#9=0#35=4#34=2#49=TW#52=20031027-14:29:11#56=ISLD#36=10#123=Y#10=000#</send>
            <expect>
                8=FIX\.4\.4#9=\d{1,3}#35=0#34=2#49=ISLD#52=\d{8}-\d{2}:\d{2}:\d{2}(\.\d{3})?#56=TW#10=\d{3}#
            </expect>

            <send>8=FIX.4.4#9=0#35=0#34=10#49=TW#52=20031027-14:29:11#56=ISLD#10=000#</send>            
            <expect>
                8=FIX\.4\.4#9=\d{1,3}#35=0#34=3#49=ISLD#52=\d{8}-\d{2}:\d{2}:\d{2}(\.\d{3})?#56=TW#10=\d{3}#
            </expect>
        </transport>
        &ENGINE_DOWN;
    </case>
</cases>
