<?xml version="1.0" encoding="UTF-8"?>
<!DOCTYPE cases SYSTEM "../../../../cases.dtd" [
        <!ENTITY % content SYSTEM "../../../../Engine/Entities/definitions.inc">
        %content; ]>
<cases>
    <case name="2t_FirstThreeFieldsOutOfOrder.def">
        &CLEAN_LOGS;
        &ENGINE_UP_WITH_ECHO_APP;

        <!--# Send messages BeginString, BodyLength and MsgType in wrong order-->
        <transport className="InitiatorSocketTransport" host="localhost" port="3000">

            <send>8=FIX.4.3#9=123#35=A#34=1#49=TW#52=20031027-14:29:11#56=ISLD#98=0#108=5#10=000#</send>
            <expect>
                8=FIX\.4\.3#9=\d{1,3}#35=A#34=1#49=ISLD#52=\d{8}-\d{2}:\d{2}:\d{2}(\.\d{3})?#56=TW#98=0#108=5#10=\d{3}#
            </expect>

            <!--# 35 is first, should be second-->

            <send>35=0#8=FI#9=123X.4.3#9=29#34=2#49=TW#52=20031027-14:29:11#56=ISLD#10=121#10=000#</send>
            <send>8=FIX.4.3#9=123#35=1#34=2#49=TW#52=20031027-14:29:11#56=ISLD#112=HELLO#10=000#</send>
            <expect>
                8=FIX\.4\.3#9=\d{1,3}#35=0#34=2#49=ISLD#52=\d{8}-\d{2}:\d{2}:\d{2}(\.\d{3})?#56=TW#112=HELLO#10=\d{3}#
            </expect>

            <!--# 34 is second, should be third-->

            <send>8=FIX.4.3#9=123#34=3#35=0#49=TW#52=20031027-14:29:11#56=ISLD#10=000#</send>
            <send>8=FIX.4.3#9=123#35=1#34=3#49=TW#52=20031027-14:29:11#56=ISLD#112=HELLO#10=000#</send>
            <expect>
                8=FIX\.4\.3#9=\d{1,3}#35=0#34=3#49=ISLD#52=\d{8}-\d{2}:\d{2}:\d{2}(\.\d{3})?#56=TW#112=HELLO#10=\d{3}#
            </expect>

            <!--# logout message and response-->

            <send>8=FIX.4.3#9=123#35=5#34=4#49=TW#52=20031027-14:29:11#56=ISLD#10=000#</send>
            <expect>8=FIX\.4\.3#9=\d{1,3}#35=5#34=4#49=ISLD#52=\d{8}-\d{2}:\d{2}:\d{2}(\.\d{3})?#56=TW#10=\d{3}#
            </expect>
        </transport>
        &ENGINE_DOWN;
    </case>
</cases>
