<?xml version="1.0" encoding="UTF-8"?>

<!DOCTYPE cases SYSTEM "../../../cases.dtd" [
        <!ENTITY % content SYSTEM "../../../Engine/Entities/definitions.inc">
        %content; ]>

<cases>
    <!-- this test depends on optional task, a way different for every engine -->
    <case name="test quietLogonMode option">
        &CLEAN_LOGS;
        <task className="FixEngine.EngineUp">
            <param name="port">&ENGINE_PORT;</param>
            <param name="name">SERVER</param>
            <param name="global_forceSeqNumReset">Always</param>
            <!--<param name="global_quietLogonMode">false</param>-->
        </task>
        <transport className="AcceptorSocketTransport" port="&PORT;">
            &SESSION_UP;
            <expect>8=FIX\.4\.2#9=\d*#35=A#49=Engine#56=Tester#34=1#52=&DATETIMEMS;#98=0#141=Y#108=5#10=\d{3}#</expect>
            <send>8=FIX.4.2#9=0#35=5#49=Tester#56=Engine#34=100#52=20031027-14:29:11#10=126#</send>
            <expect>8=FIX\.4\.2#9=\d*#35=2#49=Engine#56=Tester#34=2#52=&DATETIMEMS;#7=1#16=0#10=\d{3}#</expect>
            <send>8=FIX.4.2#9=0#35=4#49=Tester#56=Engine#34=1#52=20031027-14:29:11#43=Y#122=20150109-09:14:01#123=Y#36=100#10=126#</send>
            <expect>8=FIX\.4\.2#9=\d*#35=5#49=Engine#56=Tester#34=3#52=&DATETIMEMS;#58=First message is not logon#10=\d{3}#</expect>
            &SESSION_DOWN;
        </transport>
        <transport className="AcceptorSocketTransport" port="&PORT;">
            &SESSION_UP;
            <expect>8=FIX\.4\.2#9=\d*#35=A#49=Engine#56=Tester#34=1#52=&DATETIMEMS;#98=0#141=Y#108=5#10=\d{3}#</expect>
            <send>8=FIX.4.2#9=0#35=A#49=Tester#56=Engine#34=1#52=20031027-14:29:11#98=0#141=Y#108=5#10=126#</send>
            <expect>8=FIX\.4\.2#9=\d*#35=0#49=Engine#56=Tester#34=2#52=&DATETIMEMS;#10=\d{3}#</expect>
            <send>8=FIX.4.2#9=0#35=5#49=Tester#56=Engine#34=2#52=20031027-14:29:11#10=126#</send>
            <expect>8=FIX\.4\.2#9=\d*#35=5#49=Engine#56=Tester#34=3#52=&DATETIMEMS;#58=Confirming logout#10=\d{3}#</expect>
            &SESSION_DOWN;
        </transport>
        &ENGINE_DOWN;
    </case>
</cases>
