<?xml version="1.0" encoding="UTF-8"?>

<!DOCTYPE cases SYSTEM "misc/cases.dtd" [
        <!ENTITY % content SYSTEM "misc/entity/definitions.inc">
        %content; ]>


<!--- This is scenario to check engine properly handle resend requests while logging out -->
<!--
Expected flow:
engine sends logout, but instead of logout receives resend request.
Engine should not logout until receives logout answer from counterparty!!!
It should propertly handle this situation and resend all requested messages.
 -->
<cases>
    <case name="Respond properly to resend request on logout">

        &CLEAN_LOGS;

        &ENGINE_UP;
        <transport className="AcceptorSocketTransport" port="&PORT;">
            <!-- Ask engine to connect to FIXTester Acceptor transport -->
            &SESSION_UP;

            <!-- Hadnshake: Exchange with logons -->
            &RECEIVE_LOGON;
            &SEND_LOGON;

            <!-- Exchange with test request to ensure sequences is ok-->
            <send>8=FIX.4.2#9=57#35=1#49=&ME;#56=&YOU;#34=2#52=20031027-14:29:11#112=test01#10=126#</send>
            <expect>8=FIX\.4\.2#9=\d*#35=0#49=&YOU;#56=&ME;#34=2#112=test01#52=&DATETIMEMS;#10=\d{3}#</expect>

            <!-- Ask engine to send 1 dummy order message to FIXTester Acceptor transport -->
            &SEND_MESSAGE;
            <expect>8=FIX\.4\.2#9=\d*#35=D#49=&YOU;#56=&ME;#11=ORD:1019746829718#34=3#52=&DATETIMEMS;#10=\d{3}#</expect>
            <!-- And shutdown session. This means engine should send us logout and wait for our reponse -->
            &SESSION_DOWN;
            <expect>8=FIX\.4\.2#9=\d*#35=5#49=&YOU;#56=&ME;#34=4#52=&DATETIMEMS;#10=\d{3}#</expect>

            <!-- But we weirdly pretend we don't receive any previous message. And send resend request instead of logout -->
            <send>8=FIX.4.2#9=57#35=2#49=&ME;#56=&YOU;#34=3#52=20031027-14:29:11#7=2#16=0#10=126#</send>

            <!-- Engine should send us gap fill for hearbeat and resend order with possDup=Y and OrigSendingTime!!!-->
            <expect>8=FIX\.4\.2#9=\d*#35=4#49=&YOU;#56=&ME;#34=2#52=&DATETIMEMS;#122=&DATETIMEMS;#43=Y#36=3#123=Y#10=\d{3}#</expect>
            <expect>8=FIX\.4\.2#9=\d*#35=D#49=&YOU;#56=&ME;#34=3#52=&DATETIMEMS;#43=Y#122=&DATETIMEMS;#43=Y#10=\d{3}#
            </expect>
            <expect>8=FIX\.4\.2#9=\d*#35=4#49=&YOU;#56=&ME;#34=4#52=&DATETIMEMS;#122=&DATETIMEMS;#43=Y#36=5#123=Y#10=\d{3}#</expect>


            <send>8=FIX.4.2#9=123#35=5#49=&ME;#56=&YOU;#34=4#52=20031027-14:29:11#10=123#</send>
            <!-- should disconnet -->
            <expect></expect>

        </transport>
        <transport className="AcceptorSocketTransport" port="&PORT;">
            <!-- Ask engine to connect to FIXTester Acceptor transport -->
            &SESSION_UP;
            <!-- Hadnshake: Exchange with logons -->
            <expect>8=FIX\.4\.2#9=\d*#35=A#49=&YOU;#56=&ME;#34=5#52=&DATETIMEMS;#98=0#108=5#10=\d{3}#
            </expect>
            <send>8=FIX.4.2#9=57#35=A#49=&ME;#56=&YOU;#34=5#52=20031027-14:29:11#98=0#108=5#10=126#</send>
            <!-- Exchange with test request to ensure sequences is ok-->
            <send>8=FIX.4.2#9=57#35=1#49=&ME;#56=&YOU;#34=6#52=20031027-14:29:11#112=test01#10=126#</send>
            <expect>8=FIX\.4\.2#9=\d*#35=0#49=&YOU;#56=&ME;#34=6#112=test01#52=&DATETIMEMS;#10=\d{3}#</expect>

            <!-- logoff to speed up engine shutdown time-->
            <send>8=FIX.4.2#9=123#35=5#49=&ME;#56=&YOU;#34=7#52=20031027-14:29:11#10=123#</send>
        </transport>
        &ENGINE_DOWN;
    </case>
</cases>