<?xml version="1.0" encoding="UTF-8"?>

<!DOCTYPE cases SYSTEM "../../../cases.dtd" [
        <!ENTITY % content SYSTEM "../../../Engine/Entities/definitions.inc">
        %content; ]>


<!--- This is scenario to check engine do logoff and reconnect if receive no answer after 2 test requests -->
<cases>
    <case name="Garbled">
        &CLEAN_LOGS;
        &ENGINE_UP;
        <transport className="AcceptorSocketTransport" port="&PORT;">
            <!-- Ask engine to connect to FIXTester Acceptor transport -->
            &SESSION_UP;

            &RECEIVE_LOGON;
            &SEND_LOGON;
            <send>11111111111111111111111111111111111111111111111111111#10=122#</send>
            <send>8=FIX.4.2#9=57#35=0#49=&ME;#56=&YOU;#34=2#52=20031027-14:29:11#10=126#</send>
            <expect>8=FIX\.4\.2#9=\d*#35=0#49=&YOU;#56=&ME;#34=2#52=&DATETIMEMS;#10=\d{3}#</expect>
            <!-- logout -->
            <send>8=FIX.4.2#9=57#35=5#49=&ME;#56=&YOU;#34=3#52=20031027-14:29:11#10=126#</send>
            <expect>8=FIX\.4\.2#9=\d*#35=5#49=&YOU;#56=&ME;#34=3#52=&DATETIMEMS;#10=\d{3}#</expect>

        </transport>
        <!--transport className="AcceptorSocketTransport" port="&PORT;">

            <expect>8=FIX\.4\.2#9=\d*#35=A#49=&YOU;#56=&ME;#34=2#52=&DATETIMEWITHOUTMS;#98=0#108=5#10=\d{3}#</expect>

            <send>8=FIX.4.2#9=57#35=A#49=&ME;#56=&YOU;#34=3#52=20031027-14:29:11#98=0#108=5#10=126#</send-->


        <!-- logout -->
        <!--send>8=FIX.4.2#9=57#35=5#49=&ME;#56=&YOU;#34=4#52=20031027-14:29:11#10=126#</send>
            <expect>8=FIX\.4\.2#9=\d*#35=5#49=&YOU;#56=&ME;#34=3#52=&DATETIMEMS;#10=\d{3}#</expect>

        </transport-->
        &ENGINE_DOWN;
    </case>
</cases>