<?xml version="1.0" encoding="UTF-8"?>

<!DOCTYPE cases SYSTEM "../../../cases.dtd" [
        <!ENTITY % content SYSTEM "../../../Engine/Entities/definitions.inc">
        %content; ]>

<cases>
  <case name="CME specification test Process expired messages from queue">
    &CLEAN_LOGS;

    <task className="FixEngine.SetGlobalConfig">
      <param name="sourceFile">./Engine/Cases/Cme/cme_config.properties</param>
    </task>

    <task className="FixEngine.EngineUpWithEchoApp">
      <param name="port">&ENGINE_PORT;</param>
      <param name="name">SERVER</param>
    </task>


    <transport className="InitiatorSocketTransport" host="localhost" port="&ENGINE_PORT;">

        <send>    8=FIX.4.2#9=123#35=A#34=1#49=CME#52=20031027-14:29:11.123#56=B08004N#98=0#108=5#10=000#</send>
        <expect>  8=FIX\.4\.2#9=\d{1,3}#35=A#34=1#49=B08004N#52=\d{8}-\d{2}:\d{2}:\d{2}(\.\d{3})?#56=CME#10=\d{3}#</expect>


        <send>    8=FIX.4.2#9=307#35=8#34=5#369=1#52=20031027-14:29:11.123#49=CME#50=99#56=B08004N#57=0J4L#143=US#17=0005A#10=000#</send>
        <expect>  8=FIX\.4\.2#9=\d{1,3}#35=2#34=2#49=B08004N#52=\d{8}-\d{2}:\d{2}:\d{2}(\.\d{3})?#56=CME#7=2#16=0#10=\d{3}#</expect>


        <send>    8=FIX.4.2#9=307#35=8#34=6#369=1#52=20031027-14:29:11.123#49=CME#50=99#56=B08004N#57=0J4L#143=US#17=0006A#10=000#</send>
        <send>    8=FIX.4.2#9=307#35=8#34=7#369=1#52=20031027-14:29:11.123#49=CME#50=99#56=B08004N#57=0J4L#143=US#17=0007A#10=000#</send>


        <send>    8=FIX.4.2#9=307#35=4#34=2#369=2#52=20031027-14:29:11.123#43=Y#49=CME#50=99#56=B08004N#57=0J4L#143=US#36=1000#123=Y#10=000#</send>


        <send>    8=FIX.4.2#9=307#35=8#34=1000#369=2#52=20031027-14:29:11.123#49=CME#50=99#56=B08004N#57=0J4L#143=US#17=1000A#10=000#</send>
        <expect>  8=FIX\.4\.2#9=\d{1,3}#35=8#34=3#49=B08004N#52=\d{8}-\d{2}:\d{2}:\d{2}(\.\d{3})?#56=CME#17=1000A#10=\d{3}#</expect>


        <send>    8=FIX.4.2#9=123#35=5#34=1001#49=CME#52=20031027-14:29:11#56=B08004N#10=000#    </send>
        <expect>  8=FIX\.4\.2#9=\d{1,3}#35=5#34=4#49=B08004N#52=\d{8}-\d{2}:\d{2}:\d{2}(\.\d{3})?#56=CME#10=\d{3}#</expect>

    </transport>

    &ENGINE_DOWN;
  </case>
</cases>
