<?xml version="1.0" encoding="UTF-8"?>
<!DOCTYPE cases SYSTEM "../../../cases.dtd" [
        <!ENTITY % content SYSTEM "../../../Engine/Entities/definitions.inc">
        %content; ]>
<cases>
    <case name="BBP-19499: Engine goes to infinite loop during session connect and sequences reset">
        &CLEAN_LOGS;
        <task className="FixEngine.EngineUpWithEchoApp">
            <param name="port">&ENGINE_PORT;</param>
            <param name="name">SERVER</param>
            <param name="reset">true</param>
            <param name="global_ignoreResetSeqNumFlagOnReset">true</param>
            <param name="global_switchOffSendingMultipleResendRequests">true</param>
        </task>

        <transport className="InitiatorSocketTransport" host="localhost" port="&ENGINE_PORT;">
            <send>8=FIX.4.4#9=123#35=A#34=1#49=TW#52=20031027-14:29:11#56=ISLD#98=0#108=5#10=000#</send>
            <expect>
                8=FIX\.4\.4#9=\d{1,3}#35=A#34=1#49=ISLD#52=\d{8}-\d{2}:\d{2}:\d{2}(\.\d{3})?#56=TW#10=\d{3}#
            </expect>

            <send>
                8=FIX.4.4#9=123#35=D#34=2#49=TW#52=20031027-14:29:11#43=Y#122=20031027-14:29:11#56=ISLD#11=ID#21=1#40=1#54=1#38=200#55=INTC#60=20031027-14:29:11#10=000#
            </send>
            <expect>
                8=FIX\.4\.4#9=\d{1,3}#35=D#34=2#49=ISLD#52=\d{8}-\d{2}:\d{2}:\d{2}(\.\d{3})?#56=TW#10=\d{3}#
            </expect>

            <send>8=FIX.4.4#9=123#35=5#34=3#49=TW#52=20031027-14:29:11#56=ISLD#10=000#</send>
            <expect>8=FIX\.4\.4#9=\d{1,3}#49=ISLD#52=\d{8}-\d{2}:\d{2}:\d{2}(\.\d{3})?#56=TW#10=\d{3}#</expect>
        </transport>

        <task className="FixEngine.SessionAwaitDisconnectTask">
          <param name="sessionIdName">ISLD-TW</param>
        </task>

        <transport className="InitiatorSocketTransport" host="localhost" port="&ENGINE_PORT;">
            <send>8=FIX.4.4#9=123#35=A#34=4#49=TW#52=20031027-14:29:11#56=ISLD#98=0#108=5#10=000#</send>
            <expect>
                8=FIX\.4\.4#9=\d{1,3}#35=A#34=1#49=ISLD#52=\d{8}-\d{2}:\d{2}:\d{2}(\.\d{3})?#56=TW#10=\d{3}#
            </expect>
            <expect>
                8=FIX\.4\.4#9=\d{1,3}#35=2#34=2#49=ISLD#52=\d{8}-\d{2}:\d{2}:\d{2}(\.\d{3})?#56=TW#7=1#16=0#10=\d{3}#
            </expect>

            <send>8=FIX.4.4#9=123#35=5#34=5#49=TW#52=20031027-14:29:11#56=ISLD#10=000#</send>
            <expect>8=FIX\.4\.4#9=\d{1,3}#49=ISLD#52=\d{8}-\d{2}:\d{2}:\d{2}(\.\d{3})?#56=TW#10=\d{3}#</expect>
        </transport>

      <task className="FixEngine.SessionAwaitDisconnectTask">
        <param name="sessionIdName">ISLD-TW</param>
      </task>

      <transport className="InitiatorSocketTransport" host="localhost" port="&ENGINE_PORT;">
            <send>8=FIX.4.4#9=123#35=A#34=6#49=TW#52=20031027-14:29:11#56=ISLD#98=0#108=5#10=000#</send>
            <expect>
                8=FIX\.4\.4#9=\d{1,3}#35=A#34=1#49=ISLD#52=\d{8}-\d{2}:\d{2}:\d{2}(\.\d{3})?#56=TW#10=\d{3}#
            </expect>
            <expect>
                8=FIX\.4\.4#9=\d{1,3}#35=2#34=2#49=ISLD#52=\d{8}-\d{2}:\d{2}:\d{2}(\.\d{3})?#56=TW#7=1#16=0#10=\d{3}#
            </expect>

            <send>8=FIX.4.4#9=123#35=5#34=7#49=TW#52=20031027-14:29:11#56=ISLD#10=000#</send>
            <expect>8=FIX\.4\.4#9=\d{1,3}#49=ISLD#52=\d{8}-\d{2}:\d{2}:\d{2}(\.\d{3})?#56=TW#10=\d{3}#</expect>
        </transport>
        &ENGINE_DOWN;
    </case>
</cases>
