<?xml version="1.0" encoding="UTF-8"?>
<!DOCTYPE cases SYSTEM "../../../../cases.dtd" [
        <!ENTITY % content SYSTEM "../../../../Engine/Entities/definitions.inc">
        %content; ]>
<cases>
    <case name="1a_ValidLogonMsgSeqNumTooHigh.def">
        &CLEAN_LOGS;
        &ENGINE_UP_WITH_ECHO_APP;

        <!--# resend request-->
        <transport className="InitiatorSocketTransport" host="localhost" port="3000">

            <send>8=FIX.4.0#9=123#35=A#34=5#49=TW#52=20031027-14:29:11#56=ISLD#98=0#108=5#10=000#</send>
            <expect>8=FIX\.4\.0#9=\d{1,3}#35=A#34=1#49=ISLD#52=\d{8}-\d{2}:\d{2}:\d{2}#56=TW#98=0#108=5#10=\d{3}#
            </expect>

            <expect>8=FIX\.4\.0#9=\d{1,3}#35=2#34=2#49=ISLD#52=\d{8}-\d{2}:\d{2}:\d{2}#56=TW#7=1#16=999999#10=\d{3}#
            </expect>

            <!--# logout message and response-->
            <send>8=FIX.4.0#9=123#35=4#34=6#49=TW#52=20031027-14:29:11#56=ISLD#123=N#36=7#10=000#</send>
            <send>8=FIX.4.0#9=123#35=5#34=7#49=TW#52=20031027-14:29:11#56=ISLD#10=000#</send>
            <expect>8=FIX\.4\.0#9=\d{1,3}#35=5#34=3#49=ISLD#52=\d{8}-\d{2}:\d{2}:\d{2}#56=TW#10=\d{3}#</expect>
        </transport>
        &ENGINE_DOWN;
    </case>
</cases>
