<?xml version="1.0" encoding="UTF-8"?>
<!DOCTYPE cases SYSTEM "../../../../cases.dtd" [
        <!ENTITY % content SYSTEM "../../../../Engine/Entities/definitions.inc">
        %content; ]>
<cases>
    <case name="3b_InvalidChecksum.def" updater="SmartUpdater">
        &CLEAN_LOGS;
        &ENGINE_UP_WITH_ECHO_APP;

        <!--# If message has incorrect checksum, it should be ignored-->
        <transport className="InitiatorSocketTransport" host="localhost" port="3000">

            <send>8=FIX.4.4#9=0#35=A#34=1#49=TW#52=00000000-00:00:00#56=ISLD#98=0#108=5#10=000#</send>
            <expect>
                8=FIX\.4\.4#9=\d{1,3}#35=A#34=1#49=ISLD#52=\d{8}-\d{2}:\d{2}:\d{2}(\.\d{3})?#56=TW#98=0#108=5#10=\d{3}#
            </expect>

            <!--# Incorrect checksum-->
            <send>8=FIX.4.4#9=0#35=0#34=2#49=TW#52=00000000-00:00:00#56=ISLD#10=256#</send>

            <!--# Correct checksum-->
            <send>8=FIX.4.4#9=0#35=0#34=2#49=TW#52=00000000-00:00:00#56=ISLD#10=000#</send>

            <!--# Incorrect checksum-->
            <send>8=FIX.4.4#9=0#35=D#34=3#49=TW#52=00000000-00:00:00#56=ISLD#11=ID#21=3#40=1#54=1#55=INTC#38=1#10=256#</send>

            <send>8=FIX.4.4#9=0#35=0#34=4#49=TW#52=00000000-00:00:00#56=ISLD#10=000#</send>

            <!--# Resend request for missed message-->
            <expect>
                8=FIX\.4\.4#9=\d{1,3}#35=2#34=2#49=ISLD#52=\d{8}-\d{2}:\d{2}:\d{2}(\.\d{3})?#56=TW#7=3#16=0#10=\d{3}#
            </expect>

            <send>8=FIX.4.4#9=0#35=D#34=3#49=TW#52=00000000-00:00:00#43=Y#122=20031027-14:29:11#56=ISLD#11=ID#21=3#40=1#54=1#55=INTC#38=1#60=20000101-01:00:00#10=000#</send>
            
            <expect>
                8=FIX\.4\.4#9=\d{1,3}#35=D#34=3#49=ISLD#52=\d{8}-\d{2}:\d{2}:\d{2}(\.\d{3})?#56=TW#11=ID#21=3#40=1#54=1#55=INTC#38=1#60=20000101-01:00:00#
            </expect>

            <send>8=FIX.4.4#9=0#35=4#34=4#49=TW#52=00000000-00:00:00#43=Y#122=20031027-14:29:11#56=ISLD#36=5#123=Y#10=000#</send>

            <!--# logout message and response-->
            <send>8=FIX.4.4#9=0#35=5#34=5#49=TW#52=00000000-00:00:00#56=ISLD#10=000#</send>
            <expect>8=FIX\.4\.4#9=\d{1,3}#35=5#34=4#49=ISLD#52=\d{8}-\d{2}:\d{2}:\d{2}(\.\d{3})?#56=TW#10=\d{3}#
            </expect>
        </transport>
        &ENGINE_DOWN;
    </case>
</cases>
