<?xml version="1.0" encoding="UTF-8"?>
<!DOCTYPE cases SYSTEM "../../../../cases.dtd" [
        <!ENTITY % content SYSTEM "../../../../Engine/Entities/definitions.inc">
        %content; ]>
<cases>
    <case name="2 TestRequest before disconnect">
        &CLEAN_LOGS;
        <task className="FixEngine.EngineUpWithEchoApp">
            <param name="port">&ENGINE_PORT;</param>
            <param name="name">SERVER</param>
            <param name="global_advancedResendRequestProcessing">true</param>
        </task>

        <transport className="InitiatorSocketTransport" host="localhost" port="3000">
            <send>8=FIX.4.2#9=123#35=A#34=1#49=&ME;#52=&DATETIMEMS;#56=&YOU;#98=0#108=10#10=000#</send>
            <expect>8=FIX\.4\.2#9=\d{1,3}#35=A#34=1#49=&YOU;#52=&DATETIMEMS;#56=&ME;#10=\d{3}#</expect>


            <send>8=FIX.4.2#9=0#35=0#34=5#49=&ME;#52=&DATETIMEMS;#56=&YOU;#369=1#10=000#</send>
            <expect>8=FIX\.4\.2#9=\d{1,3}#35=2#34=2#49=&YOU;#52=&DATETIMEMS;#56=&ME;#7=2#16=0#10=\d{3}#</expect>

            <send>8=FIX.4.2#9=0#35=0#34=6#49=&ME;#52=&DATETIMEMS;#56=&YOU;#369=1#10=000#</send>
            <expect>8=FIX\.4\.2#9=\d{1,3}#35=2#34=3#49=&YOU;#52=&DATETIMEMS;#56=&ME;#43=Y#7=2#16=0#10=\d{3}#</expect>

        </transport>
        &ENGINE_DOWN;
    </case>
</cases>
