<?xml version="1.0" encoding="UTF-8"?>

<!DOCTYPE cases SYSTEM "../../../../cases.dtd" [
        <!ENTITY % content SYSTEM "../../../../Engine/Entities/definitions.inc">
        %content; ]>

<cases>

    <!--case SRM03 A -->
    <!--testzilla case 10a_002_SR A -->
    <!--Step 1. Receive Sequence Reset (Gap Fill) message with NewSeqNo > MsgSeqNum and MsgSeqNum > than  -->
    <!--Step 2. 8=FIX.4.4 9=59 35=4 49=SNDR 56=TRGT 34=6 52=20081225-18:32:15 123=Y 36=10 10=202  	-->
    <!--Step 2. FIXAJ should send Resend Request message to Initiator with 34=2, 7=2, 16=0 -->
    <!--Step 2. 8=FIX.4.4 9=59 35=4 49=SNDR 56=TRGT 34=6 52=20081225-18:32:15 123=Y 36=10 10=202  	-->
    <!--Step 2. FIXAJ should send Log out seq to low -->

    <case name="SRM03">
        &CLEAN_LOGS;

        <task className="FixEngine.EngineUp">
            <param name="port">&ENGINE_PORT;</param>
            <param name="name">SERVER</param>
            <param name="global_resendRequestNumberOfMessagesLimit">1000</param>
            <param name="global_ignorePossDupForGapFill">false</param>
        </task>
        
        <transport className="InitiatorSocketTransport" host="localhost" port="3000">
            <send>8=FIX.4.4#9=123#35=A#34=1#49=TW#52=20031027-14:29:11#56=ISLD#98=0#108=5#10=000#</send>
            <expect>
                8=FIX\.4\.4#9=\d{1,3}#35=A#34=1#49=ISLD#52=\d{8}-\d{2}:\d{2}:\d{2}(\.\d{3})?#56=TW#10=\d{3}#
            </expect>

            <send>8=FIX.4.4#9=0#35=4#34=4#49=TW#52=20031027-14:29:11#56=ISLD#36=10#123=Y#10=000#</send>
            <expect>
                8=FIX\.4\.4#9=\d{1,3}#35=2#34=2#49=ISLD#52=\d{8}-\d{2}:\d{2}:\d{2}(\.\d{3})?#56=TW#7=2#16=0#10=\d{3}#
            </expect>

            <send>8=FIX.4.4#9=0#35=4#34=4#49=TW#52=20031027-14:29:11#56=ISLD#36=10#123=Y#10=000#</send>
            <expect>
                8=FIX\.4\.4#9=\d{1,3}#35=5#34=3#49=ISLD#52=\d{8}-\d{2}:\d{2}:\d{2}(\.\d{3})?#56=TW#10=\d{3}#
            </expect>
        </transport>
        &ENGINE_DOWN;
    </case>
</cases>
