<?xml version="1.0" encoding="UTF-8"?>
<!DOCTYPE cases SYSTEM "../../../cases.dtd" [
        <!ENTITY % content SYSTEM "../../../Engine/Entities/definitions.inc">
        %content; ]>
<cases>
    <case name="CASE RR">
        &CLEAN_LOGS;
        &ENGINE_UP_WITH_ECHO_APP;

        <transport className="InitiatorSocketTransport" host="localhost" port="3000">

            <send>8=FIX.4.4#9=123#35=A#34=1#49=TW#52=20031027-14:29:11#56=ISLD#98=0#108=5#10=000#</send>
            <expect>
                8=FIX\.4\.4#9=\d{1,3}#35=A#34=1#49=ISLD#52=\d{8}-\d{2}:\d{2}:\d{2}(\.\d{3})?#56=TW#10=\d{3}#
            </expect>

            <!-- send orders -->
            <send>
                8=FIX.4.4#9=0#35=D#49=TW#56=ISLD#34=2#50=1#52=00000000-00:00:00#11=cboeopt-06#1=TEST01#21=1#100=DSMD#55=MSFT#54=1#60=20100528-13:02:21#38=100#40=2#44=10#5049=ASH#5056=EHUB#5050=20100528-13:09:41.058#10=000#
            </send>
            <expect>8=FIX\.4\.4#9=\d{1,3}#35=D#10=\d{3}#</expect>
            <send>
                8=FIX.4.4#9=0#35=D#49=TW#56=ISLD#34=3#50=1#52=00000000-00:00:00#11=cboeopt-06#1=TEST01#21=1#100=DSMD#55=MSFT#54=1#60=20100528-13:02:21#38=100#40=2#44=10#5049=ASH#5056=EHUB#5050=20100528-13:09:41.058#10=000#
            </send>
            <expect>8=FIX\.4\.4#9=\d{1,3}#35=D#10=\d{3}#</expect>
            <send>
                8=FIX.4.4#9=0#35=D#49=TW#56=ISLD#34=4#50=1#52=00000000-00:00:00#11=cboeopt-06#1=TEST01#21=1#100=DSMD#55=MSFT#54=1#60=20100528-13:02:21#38=100#40=2#44=10#5049=ASH#5056=EHUB#5050=20100528-13:09:41.058#10=000#
            </send>
            <expect>8=FIX\.4\.4#9=\d{1,3}#35=D#10=\d{3}#</expect>

            <expect>8=FIX\.4\.4#9=\d{1,3}#35=0#10=\d{3}#</expect>

            <send>
                8=FIX.4.4#9=0#35=2#34=5#49=TW#52=00000000-00:00:00#43=Y#122=20031027-14:29:11#56=ISLD#7=3#16=1#10=000#
            </send>
            <expect>
                8=FIX\.4\.4#9=\d{1,3}#35=3#34=6#49=ISLD#52=\d{8}-\d{2}:\d{2}:\d{2}(\.\d{3})?#56=TW#58=[\w\s\p{P}\p{Sm}]*#10=\d{3}#
            </expect>
        </transport>
        &ENGINE_DOWN;
    </case>
</cases>
