<?xml version="1.0" encoding="UTF-8"?>

<!DOCTYPE cases SYSTEM "../../../cases.dtd" [
        <!ENTITY % content SYSTEM "../../../Engine/Entities/definitions.inc">
        %content; ]>

<cases>
    <case name="Normal.def">
        &CLEAN_LOGS;
        <task className="FixEngine.EngineUp">
            <param name="port">&ENGINE_PORT;</param>
            <param name="name">SERVER</param>
            <param name="global_handleSeqNumAtLogon">true</param>
            <param name="global_outgoingStorageIndexed">false</param>
        </task>
        <transport className="AcceptorSocketTransport" port="&PORT;">
            <task className="FixEngine.SessionUpTask">
                <param name="FixVersion">FIX.4.4</param>
                <param name="host">&HOST;</param>
                <param name="port">&PORT;</param>
                <param name="SenderCompID">Engine</param>
                <param name="TargetCompID">Tester</param>
                <param name="sessionIdName">sessionId</param>
                <param name="hbtInterval">2</param>
            </task>
            <expect>
                8=FIX\.4\.4#9=\d{1,3}#35=A#34=1#49=Engine#52=\d{8}-\d{2}:\d{2}:\d{2}\.\d{3}#56=Tester#98=0#108=2#789=1#10=\d{3}#
            </expect>
            <send>8=FIX.4.4#9=123#35=A#34=1#49=Tester#52=20031027-14:29:11#56=Engine#98=0#108=2#789=2#10=126#</send>

            <expect>8=FIX\.4\.4#9=\d{1,3}#35=0#34=2#49=Engine#56=Tester#52=\d{8}-\d{2}:\d{2}:\d{2}(\.\d{3})?#10=\d{3}#</expect>
            <!--<send>8=FIX.4.2#9=0#35=0#34=2#49=Tester#56=Engine#52=20101111-11:46:33.755#10=000#</send>-->

            <send>8=FIX.4.4#9=123#35=5#34=2#49=Tester#52=20031027-14:29:11#56=Engine#10=126#</send>

            <expect>8=FIX\.4\.4#9=\d{1,3}#35=5#34=3#49=Engine#52=\d{8}-\d{2}:\d{2}:\d{2}\.\d{3}#56=Tester#10=\d{3}#
            </expect>
            &SESSION_DOWN;
        </transport>

       <transport className="AcceptorSocketTransport" port="&PORT;">
            <task className="FixEngine.SessionUpTask">
                <param name="FixVersion">FIX.4.4</param>
                <param name="host">&HOST;</param>
                <param name="port">&PORT;</param>
                <param name="SenderCompID">Engine</param>
                <param name="TargetCompID">Tester</param>
                <param name="sessionIdName">sessionId</param>
                <param name="hbtInterval">2</param>
            </task>
            <expect>
                8=FIX\.4\.4#9=\d{1,3}#35=A#34=4#49=Engine#52=\d{8}-\d{2}:\d{2}:\d{2}\.\d{3}#56=Tester#98=0#108=2#789=3#10=\d{3}#
            </expect>
            <send>8=FIX.4.4#9=123#35=A#34=3#49=Tester#52=20031027-14:29:11#56=Engine#98=0#108=2#789=1#10=126#</send>

           <expect>
               8=FIX\.4\.4#9=\d{1,3}#35=4#34=1#49=Engine#52=\d{8}-\d{2}:\d{2}:\d{2}(\.\d{3})?#56=Tester#123=Y#36=5#10=\d{3}#
           </expect>

            <send>8=FIX.4.4#9=123#35=5#34=4#49=Tester#52=20031027-14:29:11#56=Engine#10=126#</send>

            <expect>8=FIX\.4\.4#9=\d{1,3}#35=5#34=5#49=Engine#52=\d{8}-\d{2}:\d{2}:\d{2}\.\d{3}#56=Tester#10=\d{3}#
            </expect>
            &SESSION_DOWN;
        </transport>
        &ENGINE_DOWN;

    </case>
</cases>
